{
  "version": "0.2.0",
  "owner_block": "B9",
  "durability_block": "B14",
  "entries": [
    {
      "key": "legal.onb_consent_intro",
      "tone": "neutral",
      "legal_status": "pre-legal-review",
      "text": "[ЗАГЛУШКА] Вступление к экрану согласий онбординга.",
      "notes": "Заглушка до 0-Б. Реальный текст — после юридической вычитки."
    },
    {
      "key": "legal.consent_c0_age_18_plus",
      "tone": "strict",
      "legal_status": "pre-legal-review",
      "text": "[ЗАГЛУШКА] Согласие C0: подтверждение возраста 18+."
    },
    {
      "key": "legal.consent_c1_pdn",
      "tone": "strict",
      "legal_status": "pre-legal-review",
      "text": "[ЗАГЛУШКА] Согласие C1: обработка персональных данных."
    },
    {
      "key": "legal.offer",
      "tone": "strict",
      "legal_status": "pre-legal-review",
      "text": "[ЗАГЛУШКА] Оферта. Экран только для чтения; акцепт — вместе с оплатой (позже).",
      "notes": "1e-2, решение «В2 А»: показ после pid, в consent_events не пишется."
    }
  ]
}
